location	lat	long
Strauss Mansion Museum, 27 Prospect Circle, Atlantic Highlands, New Jersey, USA	40.411927006376644	-74.03348032419628
Lofotr Vikingmuseum, Bstad, Vestvgy, Nordland, Norway	68.24514000000005	13.757030000000043
Engelsestraat 18, 8000 Brugge, Belgium	51.21158265889551	3.227830799757594
555 West Shoreline Drive, Long Beach, California, USA	33.76313097977086	-118.19283278218553
Norco, Louisiana, USA	29.99858000000006	-90.41189999999995
Clitheroe Castle, Clitheroe, Lancashire, England, UK	53.87140000000005	-2.3923599999999396
Garges-ls-Gonesse, Val-d'Oise, France	48.98653000000007	2.4503100000000586
Saxony, KwaZulu-Natal, South Africa	-28.609879999999976	31.37585000000007
Casablanca Cafe, Fairburn, Georgia, USA	33.566590000000076	-84.58669999999995
Elleore, Denmark	55.68533000000008	12.062250000000063
Thimmanayakan Palayam, Puducherry, India	11.92993000000007	79.82470000000006
Grote Street, Adelaide, South Australia, Australia	-34.929297	138.5880868824501
GRES Acadmicos da Barra da Tijuca, Estrada do Itanhang, Barra da Tijuca, Rio de Janeiro, Rio de Janeiro, Brazil	-23.010849999999948	-43.308389999999974
Sheen Lane, East Sheen, Surrey, England, UK	51.363882000000004	-0.12569849999998126
Central Connecticut State University	41.69004000360486	-72.77077995614661
Okowai Road, Papakowhai, Porirua, Wellington Region, New Zealand	-41.12402213341178	174.85449826531593
Acton, California, USA	34.46808000000004	-118.19612999999998
Weiensee, Berlin, Germany	52.51604000000003	13.376910000000066
McAllister & Scott Streets, Hayes Valley, San Francisco, California, USA	37.778004	-122.436702
Kundapur, India	17.708060000000046	78.29750000000007
Rushville, Illinois, USA	40.11764000000005	-90.56700999999998
Hallesches Ufer, Kreuzberg, Berlin, Germany	52.49923369332098	13.380596498775372
Oxelvgen, Huddinge, Stockholms ln, Sweden	59.25643042205532	17.97334346814841
Pout Pond, Uxbridge, Massachusetts, USA	42.09051150000001	-71.64097875
Ferguson Police Department, Ferguson, Missouri, USA	38.740920000000074	-90.30354999999997
580 E Kensington Rd, Los Angeles, California, USA	34.007826911004386	-118.48146672248902
St Marys Church, Alvaston, Derby, Derbyshire, England, UK	52.89534423246557	-1.41902788243151
Korensko Sedlo, Slovenia, Yugoslavia	46.25342000000006	13.438060000000064
Maiden Lane, London, England, UK	51.54197316367556	-0.127691886757375
Jacques Lipchitz toy store, New York City, New York, USA	40.72281998167819	-73.99445001832184
Colomieu, Ain, Rhne-Alpes, France	45.73326000000003	5.6241300000000365
Mekong River	10.297350000000051	105.85087000000004
Optimum Studios - Vancouver, British Columbia, Canada	49.260380000000055	-123.11335999999994
Butrint, Albania	39.744170000000054	20.018760000000043
Fort Pickens, Florida, USA	30.32782000000003	-87.29565999999994
Bernardo Dumpsite, Las Pias City, Metro Manila, Philippines	14.613450000000057	120.98309000000006
Nike Site Baseball Park, Manchester, Connecticut, USA	41.77021618277749	-72.52513652143371
Hirschberg, Thuringia, Germany	50.405890000000056	11.819960000000037
Lowndes Hotel, 21 Lowndes Street, Westminster, London, UK	51.49884000000003	-0.15769999999997708
Las Alpujarras, Spain	36.93068000000005	-3.1956499999999437
Haut-Jura, France	46.803104482406816	5.409190809042214
Mtro Corvisart, Paris 13, Paris, France	48.83220000000006	2.3561000000000263
Pedley Street, Shoreditch, London E1, England, UK	51.52591000000007	-0.07789999999994279
16 N. Front Street, Wilmington, North Carolina, USA	34.235941986816584	-77.94873585260086
Skegness, Lincolnshire, England, UK	53.14527000000004	0.33700000000004593
Palacio Gaviria, Madrid, Spain	40.416940029430435	-3.7061499744647244
Krivoj-Rog, Ukraine	47.90966000000003	33.38044000000008
Niort, Deux-Svres, France	46.321240000000046	-0.46337999999997237
Yucca Street, Santa Fe New Mexico, USA	35.64253820117113	-105.97383646669668
Tompkinsville, Kentucky, USA	36.70118000000008	-85.69104999999996
Palazzo Taverna, Rome, Lazio, Italy	42.05186007328748	12.619150073287491
Koh Chang, Trat, Thailand	12.059470000000033	102.32941000000005
Petergate, Wandsworth, London, England, UK	51.45686000000006	-0.1944799999999418
Valle de la Durance, Alpes-de-Haute-Provence, France	44.0343051354156	5.9809382541776
The White Swan, Riverside, Twickenham, Middlesex, England, UK	51.43867000000006	-0.3323499999999626
Ted Allen Studios, Hollywood, Los Angeles, California, USA	34.10156000000006	-118.33707999999996
La Mesa Dam, Quezon City, Metro Manila, Philippines	14.656340000000057	121.0298600000001
Rotherham, South Yorkshire, England, UK	53.430300000000045	-1.354509999999948
West Mersea, England, UK	51.77959000000004	0.9128400000000738
Pasighat, Arunachal Pradesh, India	28.066310000000044	95.32678000000004
Leith Hill, Docking, Surrey, England, UK	51.170510000000036	-0.37922999999995
I. Magnin Building, 3240 Wilshire Boulevard, Los Angeles, California, USA	34.06175447561956	-118.29252052553522
Pavan Pool, Mumbai, Maharashtra, India	19.10461351234925	72.90213433596861
Gold Street, Brooklyn, New York City, New York, USA	40.697433204691386	-73.98312667251403
Hemmingen, Lower Saxony, Germany	52.32573000000008	9.722990000000038
Midnapore, Calgary, Alberta, Canada	50.91355000000004	-114.05912999999998
Ringerike, Buskerud, Norway	60.16623000000004	10.258170000000064
Filmo-ateljerna, Jungfrugatan, stermalm, Stockholm, Stockholms ln, Sweden	59.338560823825865	18.083268774271012
360 Main St, Greenville, Mississippi, USA	33.4105743797448	-91.06253209237026
Rancho Santa Marta, San Vicente, Baja California, Mexico	31.32289000000003	-116.24611999999996
Performing Arts Center of Baldwin Park - Baldwin Park California, USA	34.09100588046847	-117.97799179436342
Mtysfld, Repltr, Hungary	47.16708877000008	19.424531700000045
Northborough, Peterborough, Cambridgeshire, England, UK	52.661140000000046	-0.3004399999999805
Portugalete, Vizcaya, Pas Vasco, Spain	43.32191000000006	-3.0176799999999275
Mighty Mart - 515 E Oakey Blvd, Las Vegas, Nevada, USA	36.15125000000006	-115.15149999999994
Mayan Theater - 1038 Hill Street, Downtown, Los Angeles, California, USA	34.040603631398376	-118.25936975073596
Aigues Mortes Santes Creus, Alt Camp, Catalonia, Spain	41.79851006900003	1.5289061520000473
Sadler's Wells Theatre, Rosebery Avenue, Finsbury, London, England, UK	51.529030000000034	-0.10622999999992544
Barkers of Kensington, 63 Kensington High Street, Kensington, London, England, UK	51.49765797308178	-0.20345055567030257
Mount Trumbull Wilderness, Arizona, USA	36.41193000000004	-113.32549999999998
Davenport's Magic Shop - 7 Charing Cross Underground Arcade, Strand, London, England, UK	51.508890000000065	-0.12500999999997475
Town Hall, Brighton Street, Wallasey, Wirral, Merseyside, England, UK	53.41556000000003	-3.0237299999999436
101 North Jackson Street, Starkville, Mississippi, USA	33.46416925145709	-88.8139654087078
Macy's Diner, General Segundo Avenue, Laoag City, Ilocos Norte, Philippines	18.196810000000028	120.59453000000008
Plaza de la Democracia, Independencia Nacional, Catedral, Asuncin, Paraguay	-25.28111329989333	-57.63297432900651
Palazzo della Pilotta, Parma, Italy	44.80506001889881	10.325600042269652
Turnu Severin, Romania	44.63194000000004	22.65611000000007
Bela Vista, So Paulo, So Paulo, Brazil	-0.3666699999999423	-52.14999999999998
Glurns, Vinschgau, South Tyrol, Italy	46.68422372090436	10.545435787177311
Dubna, Russia	56.76251000000008	37.14867000000004
Hebei Province, China	39.00000000000006	116.00000000000011
Dunsmuir Mansion - Oakland, California, USA	37.796028093945516	-122.18874685125294
Prinsesse Charlottes Gade, Copenhagen, Sjlland, Denmark	55.693637546349734	12.551884889105853
Folgosinho, Gouveia, Portugal	40.50908000000004	-7.519659999999931
Eirksstair  Haukadal, Iceland	65.11878000000007	-15.482789999999966
Faye Spanos Concert Hall Stockton, California, USA	37.98133997489846	-121.3078500770355
Makapu'u Launch, O'ahu, Hawaii, USA	20.781940000000077	-156.06305999999998
Frognal Street, Camden, London, England, UK	51.53236000000004	-0.1279599999999732
Valentia Island, Co. Kerry, Ireland	51.94280619272065	-10.234023272735973
Pottersville, New York, USA	43.72774000000004	-73.81042999999994
Hundridge Manor, Chesham Road, Hyde End, Buckinghamshire, England, UK	51.70274700644314	-0.6604454435764622
Liverpool Guild of Students, Liverpool, Merseyside, England, UK	53.41009000000008	-2.978429999999946
Brgy. Mahabang Parang, Angono, Rizal, Philippines	14.549490000000048	121.18466000000001
Ann Arbor, Michigan, USA	42.28210000000007	-83.74846999999994
The Victoria Inn, 402-H Main Street, Murphys, California, USA	38.13764003000731	-120.4640999561429
Emory University - 954 Gatewood Road, Atlanta, Georgia, USA	33.80157379023982	-84.31803280130303
Ontario, California, USA	34.06457000000006	-117.64809999999994
Oude Kerk, Amsterdam, Noord-Holland, Netherlands	52.3744399378211	4.897370001730802
American Legion Memorial Bridge, Martha's Vineyard, Massachusetts, USA	41.416780000000074	-70.61613999999997
533 Grand St, Brooklyn, New York City, New York, USA	40.71108346378896	-73.95001248182237
Bocage Plantation, Darrow, Louisiana, USA	30.12453000000005	-90.95406999999994
2292 Dell Ave, Venice, California, USA	33.98507743671791	-118.4669524844969
216 Columbia Heights, Brooklyn, New York City, New York, USA	40.69670724785041	-73.99715062046276
Roosevelt Ranches, North Dakota, USA	48.351410999999985	-103.17130875000001
Grove Park, London, UK	51.46762453004492	-0.07962964488152521
The Fillmore, San Francisco, California, USA	37.78418000000005	-122.43302999999997
Hacienda de Chichimequillas, Quertaro, Mexico	20.70669668732221	-100.45524680289468
Gassin, Var, France	43.230950000000064	6.585410000000024
Peru, Vermont, USA	43.23033000000004	-72.89911999999998
Forthbridge Road, Wandsworth, London, England, UK	51.45686000000006	-0.1944799999999418
Rand, West Virginia, USA	38.27455000000003	-81.56562999999994
Berengrave Nature Reserve, Rainham, Kent, England, UK	51.38418000000007	0.5942200000000639
Gnewikow, Neuruppin, Brandenburg, Germany	52.88931000000008	12.833650000000034
Mugdock Country Park, Milngavie, Glasgow, Scotland, UK	55.945419331068436	-4.317037506390035
TVW7 Studios, Perth, Western Australia, Australia	-31.939299999999946	115.79298000000006
Former Greenpoint Savings Bank Main Branch - 807 Manhattan Avenue, Greenpoint, Brooklyn, New York City, New York, USA	40.727975050233745	-73.95323908618496
Lummi Reservation, Bellingham, Washington, USA	48.752350000000035	-122.47121999999996
Somorrostro's estuary, Somorrostro, Vizcaya, Pas Vasco, Spain	43.23744741500008	-2.8527799789999335
Valkenburg, Netherlands	50.861470000000054	5.833750000000066
Monasterio Music Theatre, Barcelona, Catalonia, Spain	41.3815199816782	2.1825600621789722
Pikkala Manor, Siuntio, Finland	60.09899000000007	24.33014000000003
Ciudad Nuclear, Cienfuegos, Cuba	22.13590000000005	-80.43930999999998
John Rylands Library, University of Manchester, Manchester, England, UK	53.46502000000004	-2.2325199999999654
Moser River, Nova Scotia, Canada	44.97637000000003	-62.25244999999995
Avenue Clarisse, Vaucresson, Hauts-de-Seine, France	48.8422128805106	2.1516070343925673
Passau, Bavaria, Germany	48.573270000000036	13.45786000000004
Hyde Park, Sydney, New South Wales, Australia	-33.87330999999995	151.2100600000001
Smedsudden, Vsterbron, Stockholm, Stockholms ln, Sweden	59.32862100000001	18.028210500000018
The Wash, East Anglia, England, UK	52.59274252100005	-1.4586262249999322
Heel, Limburg, Netherlands	51.179410000000075	5.893320000000074
200 Block of Sansome Street, Financial District, San Francisco, California, USA	37.7931656415402	-122.40109844321074
Bingol, Turkey	38.88481000000007	40.50609000000003
Harbore, Jylland, Denmark	55.959300779000046	10.053934054000024
3848 29 Ave W, Vancouver, British Columbia, Canada	49.24615652120739	-123.18944310935426
Sandown, New Hampshire, USA	42.929940000000045	-71.18780999999996
River Legacy Park, Arlington, Texas, USA	32.78271006909827	-97.11561007516146
Koliba Studios, Bratislava, Slovakia	48.20670000000007	17.03209000000004
The Port Logan Inn, Port Logan, Dumfries and Galloway, Scotland, UK	54.72419000000008	-4.955159999999978
Glenfinnan Viaduct, Fort William, Highland, Scotland, UK	57.50000000000006	-4.999999999999943
Cine International, Rome, Lazio, Italy	41.9082600255353	12.466440000000034
The Sutton Place Hotel - 38 Wellesley Street West, Toronto, Ontario, Canada	43.6645479950248	-79.386622909066
Lake Forest, Illinois, USA	42.25103000000007	-87.84172999999998
Donegal Bay, County Donegal, Ireland	54.79847273830638	-7.782865316855037
Berlin, Massachusetts, USA	42.36111000000005	-71.62858999999997
15 Washington Street, Newark, New Jersey, USA	40.74422354095914	-74.17037612116467
Chester, Cheshire, England, UK	53.18813000000006	-2.8943499999999744
Neve Shalom, Israel	31.817720000000065	34.97752000000003
Althttendorf, Brandenburg, Germany	52.962410000000034	13.806700000000035
2817 N Main St, Los Angeles, California, USA	34.06602949711447	-118.21227316763806
Superandrija, Siget, Zagreb, Croatia	45.77466000000004	15.971880000000056
Old Opera House - 149 Kentucky Street, Petaluma, California, USA	38.23944931998425	-122.64492479885972
Kosinj, Croatia	43.00556000000006	17.46750000000003
Gouffre d'Esparros, Hautes-Pyrnes, Midi-Pyrnes, France	46.55941704400004	2.5505399530000545
Pealba, Aragn, Spain	41.49923000000007	-0.0414899999999534
San Tanco, Puerto Rico	18.465610548887426	-66.11423071341875
Voorthuizen, Gelderland, Netherlands	52.18689000000006	5.605550000000051
Palcio da Comenda, Setbal, Portugal	38.508050000000026	-8.92814999999996
Bimbo's 365 Club - 1025 Columbus Avenue, North Beach, San Francisco, California, USA	37.79878000000008	-122.40793999999994
Bolinao, Pangasinan, Philippines	16.388510000000053	119.89242000000002
Mobico, 24290 Valencia Boulevard, Santa Clarita, California, USA	34.413020650384915	-118.55957118980106
Ivinghoe, Buckinghamshire, England, UK	51.822167520918896	-0.7961987613302736
U-Bahnhof Rosa-Luxemburg-Platz, Mitte, Berlin, Germany	52.526260000000036	13.411740000000066
Hydra Beach, Greece	37.351710000000026	23.463070000000073
60 Centre Street, Manhattan, New York City, New York, USA	40.714538407149945	-74.00245503410491
Port, Naples, Campania, Italy	40.857961529124815	14.27179752578911
Pukekura Park, New Plymouth, Taranaki, New Zealand	-39.066989999999976	174.0784000000001
Whitesburg, Georgia, USA	33.49365000000006	-84.91368999999997
Inner Mongolia, China	44.00000000000006	112.00000000000011
Patmos, Greece	37.32355000000007	26.54406000000006
Alitzarini Restaurant, Koilomenos, Zakynthos, Greece	37.74675000000008	20.77422000000007
Streaky Bay Jetty, Streaky Bay, South Australia, Australia	-32.79846999999995	134.21068000000002
Geddington Eleanor Glass, Geddington, Northamptonshire, England, UK	52.437370000000044	-0.6902699999999413
Communaut Adath Shalom, 8 rue George Bernard Shaw, Paris 15, Paris, France	48.84120000000007	2.3003000000000497
Bacau, Romania	46.569090000000074	26.91095000000007
Skolimw, Konstancin-Jeziorna, Mazowieckie, Poland	52.07794000000007	21.111110000000053
Shekou, China	22.49359000000004	113.91560000000004
Vanzie Swamp Salt Marsh, Falmouth, Jamaica	18.49977000000007	-77.70827999999995
Shaughnessy St, Port Coquitlam, British Columbia, Canada	49.25739895467988	-122.78269624220971
Melattur, Kerala, India	11.066670000000045	76.28333000000003
Netherlands	52.24937529300007	5.616126398000063
Egypt	26.512273493000066	29.870494860000065
Jablonec nad Jizerou, Czech Republic	50.703340000000026	15.429490000000044
VW Factory, Wolfsburg, Lower Saxony, Germany	52.42136000000005	10.787020000000041
W. 51st St. & 8th Ave., Manhattan, New York city, New York, USA	40.76289000000001	-73.98562050000001
1425 N Orange Grove Ave, Los Angeles, California, USA	34.097058000000004	-118.36040419680863
South Street and Catherine Slip, Manhattah, New York, USA	40.70919599999999	-73.9962225
Rue Froissart, Lille, Nord, France	50.620098686280116	3.0684887352899204
Celaya, Guanajuato, Mexico	20.521450000000073	-100.81397999999996
1126 Queens Way, Long Beach, California, USA	33.75200960563483	-118.19353190841566
Gorges du Tarn, Lozre, France	44.365830000000074	3.412270000000035
Ferme du Laval, Freycenet, Saint Jeures, Haute-Loire, France	45.07739000000004	4.216950000000054
Yonkers Public Library, Yonkers, New York, USA	40.961730069392374	-73.82348993392587
skemen, Kazakhstan	49.97045000000003	82.59476000000006
Robert Moses State Park, Field 2, Long Island, New York, USA	40.62365007169691	-73.27473096966668
6628 Cantaloupe Ave, Van Nuys, Los Angeles, California, USA	34.191206916180974	-118.43450080319137
Grudziadz, Kujawsko-Pomorskie, Poland	53.48460000000006	18.75010000000003
Austin, Minnesota, USA	43.66659000000004	-92.97297999999995
New Caney, Texas, USA	30.154840000000036	-95.21346999999997
Port Vincent, Louisiana, USA	30.333680000000072	-90.84993999999995
Kerkwerve, Zeeland, Netherlands	51.68596000000008	3.8996700000000715
Clear Lake, Ontario, Canada	45.00492000000003	-79.00955999999996
Grenfell Street, Adelaide, South Australia, Australia	-34.9202196019848	138.6214505632851
Cinma Delambre, rue Delambre, Paris 14, Paris, France	48.841409930607725	2.326010076605705
Via Lucio Coilio, Ostia, Rome, Lazio, Italy	41.73033968831538	12.277532187251857
Mt Arapiles, Victoria, Australia	-36.75428999999997	141.83500000000004
East Cambridge, Cambridge, Massachusetts, USA	42.36623000000003	-71.08084999999994
Old City Hall, Richmond City, Richmond, Virginia, USA	37.54083007660574	-77.43381992339431
Route 35, Monmouth County, New Jersey, USA	40.33859520056822	-74.06371431604545
Calumet County, Wisconsin, USA	44.08345076100005	-88.18359019799999
Four-Mile Bayou, Louisiana, USA	29.827236231161187	-91.12036549153598
Teverola, Italy	40.99216000000007	14.213930000000062
Petersburg Circuit Court - 7 Courthouse Avenue, Petersburg, Virginia, USA	37.230725703849096	-77.40401773809823
The Press Lounge, 653 11th Ave, New York City, New York, USA	40.76446787039065	-73.99570894353386
Boots Properties Head Office, Hargreaves House, Hanley Street, Nottingham, Nottinghamshire, England, UK	52.955584877934776	-1.1546389569642839
The Lobster Pot restaurant, Mousehole, Cornwall, England, UK	50.08257000000003	-5.539869999999951
Isa bin Salman Cultural Hall, Manama, Bahrain	26.209940000000074	50.59077000000008
Larkana, Sindh, Pakistan	27.555080000000032	68.21414000000004
Aubrey Ozenne Rd., St. Martin Parish, Louisiana, USA	30.151392156429186	-91.88996923555908
McKinlay, Queensland, Australia	-21.27147999999994	141.28907000000004
Silverado Canyon, CA	38.45742000000007	-119.19625999999994
Hutzel Women's Hospital, Detroit, Michigan, USA	42.33168000000006	-83.04799999999994
Castle Sacrow, Potsdam, Brandenburg, Germany	52.43366000000003	13.103060000000028
Baird Nakameguro Taproom, Tokyo	35.63848364900008	139.69960569500006
Santa Elena, Ecuador	-2.2298699999999485	-80.85972999999996
Arlington High School - 502 West Euclid Ave., Arlington Heights, Illinois, USA	42.088404136945144	-87.98881711664366
Kirtland Air Force Base, Albuquerque, New Mexico, USA	35.06610000000006	-106.55051999999995
The General Staff Building, St. Petersburg, Russia	59.938079952247826	30.317330045010973
3706 Princess Pl Dr, Wilmington, North Carolina, USA	34.24388127460543	-77.9007014376961
Cecil Green Park House - 6251 Cecil Green Park Road, Vancouver, British Columbia, Canada	49.27080471789351	-123.25587781121854
Universit de Lige, Sart-Tilman, Lige, Wallonia, Belgium	50.58505799999999	5.570991000000015
St. Pauli Landungsbrcken, Hamburg, Germany	53.54552317583403	9.968832214157834
Maui Film Studios Maui, Hawaii, USA	20.859534843000063	-156.56460615399996
Peroj, Istria, Croatia	44.86799000000008	13.848050000000057
Chengdu, China	30.67190000000005	104.07580000000007
Neskuchniy Sad Park, Leninsky Prospekt, Yakimanka District, Moscow, Russia	55.71973000000003	37.597770000000025
Gac, Orne, France	48.62306356800008	0.12782410800002708
Loyal Studios - 2201 N. Hollywood Way Suite #1, Burbank, California, USA	34.18860700582839	-118.34911570791712
Squamish, British Columbia, Canada	49.69854000000004	-123.15504999999996
Seattle Key Arena, Seattle, Washington, USA	47.62206000000003	-122.35533999999996
Media, Pennsylvania, USA	39.917970000000025	-75.38980999999995
Padrn, A Corua, Galicia, Spain	43.14793465185396	-8.825060218153189
Hundvg, Norway	58.99315000000007	5.72852000000006
Valle del Pas, Santander, Cantabria, Spain	43.34112900000001	-4.05292725
Were Street, Montmorencey, Victoria, Australia	-37.71657340931718	145.1211567819973
Hong Kong Marina, Hebe Haven, Sai Kung, Hong Kong, China	22.369980000000055	114.26793000000009
Andok's Farm, Rosario, Batangas, Philippines	13.844910000000027	121.20256000000006
Leeds Town Hall, The Headrow, Leeds, West Yorkshire, England, UK	53.79983004111582	-1.5496700438570654
Tenjo, Colombia	4.8721400000000585	-74.14467999999994
Evolution Studios, North Babylon, New York, USA	40.74012000000005	-73.32104999999996
Byrd Theater, Richmond, Virginia, USA	37.552220058860776	-77.47797991949918
Top of the Standard, High Line - 848 Washington Street, New York City, New York, USA	40.71455000000003	-74.00713999999994
Roundtable Restaurant, New York City, New York, USA	NaN	NaN
Neumarkt, Cologne, Germany	50.93639631113093	6.94725362418488
Mountain Ranch, California, USA	38.22863000000007	-120.54187999999999
Haverhill, Massachusetts, USA	42.777600000000064	-71.07653999999997
Highland, California, USA	34.12126000000006	-117.21713999999997
Talgarth, Brecon, Powys, Wales, UK	51.99608000000006	-3.2329899999999725
Ablis, France	48.51645000000008	1.8382700000000227
Mende, Lozre, France	44.51806000000005	3.494510000000048
Walter-Ulbricht-Stadion, 96 Chausseestrasse, East Berlin, Berlin, Germany	52.53565138605813	13.376678806249798
Wulkow, Lebus, Brandenburg, Germany	52.42635000000007	14.532650000000046
Ischia Ponte, Ischia, Naples, Campania, Italy	40.73666000000003	13.955390000000023
King Stable's Road, Edinburgh, Scotland, UK	55.9485105929055	-3.20417507783807
Moulay Idriss, Morocco	34.055210000000045	-5.523609999999962
Ramle, Israel	31.926830000000052	34.87118000000004
Grand Capucin, Mont Blanc Massif, France	45.91667000000007	6.916670000000067
Toei-Kyoto Studios, Kyoto, Japan	35.01627825800006	135.70775641300008
The Folies Stage, Tropicana Hotel & Casino - 3801 Las Vegas Boulevard South, Las Vegas, Nevada, USA	NaN	NaN
Third Street Tunnel, Bunker Hill, Downtown, Los Angeles, California, USA	34.05349000000007	-118.24531999999999
Studio Solas, Ballinahown, County Galway, Ireland	53.236385483354425	-9.505824512326074
Aiges Tortes national park, Lrida, Catalonia, Spain	42.583330000000046	1.0000000000000568
4196 Colfax Ave. Studio City, California, USA	34.145334000000005	-118.38769076654765
Sultan Hasan Mosque Madrasa, Sharia-el-Qala, Egypt	30.03184004501099	31.257019972157128
Charlottenplatz Subway Station, Stuttgart, Baden-Wrttemberg, Germany	48.77576037592774	9.183118739180003
Cap d'Agde, Languedoc-Roussillon, France	43.27662000000004	3.511030000000062
Tremembe, Sao Paulo, Brazil	-22.969539999999938	-45.54249999999996
Studio Dassonville, Brussels, Brussels-Capital, Belgium	50.8212000294304	4.36650996667452
Kyoto International Manga Museum, Kyoto, Japan	35.011697050000066	135.76816161700003
Haillicourt, Pas-de-Calais, France	50.474320000000034	2.583300000000065
Loch Arkaig, Highland, Scotland, UK	56.96667000000008	-5.133329999999944
The Back Room, Chicago, Illinois, USA	41.884250000000065	-87.63244999999995
SkyTown Entertainment Studios, New York City, New York, USA	40.71455000000003	-74.00713999999994
Pall Mall East, Westminster, London, England, UK	51.5066931451422	-0.1288326371445049
Mato Grosso, Brazil	-12.948043621999943	-55.91272516699996
Nurmijrvi, Finland	60.463130000000035	24.80601000000007
Rue du Dme, Paris 16, Paris, France	48.86370000000005	2.2769000000000688
Mt. Buller, VIC, Australia	-37.145659999999964	146.4498000000001
Ace Reel Studios, Philadelphia, Pennsylvania, USA	40.075492499999996	-75.01043025
Hvaler, Norway	59.025810000000035	11.036070000000052
Russian submarine, Folkestone Harbour, Folkestone, Kent, England, UK	51.07842753333801	1.186472884340769
San Andrs, Tenerife, Canary Islands, Spain	27.77090000000004	-17.95306999999997
Main Street Sports Bar & Grill of Plymouth, Massachusetts, USA	41.95650001110856	-70.66443993392589
St. Peter and Paul Catholic Church - Larimer Avenue, Pittsburgh, Pennsylvania, USA	40.465879235582555	-79.91291330009516
Alaska Way Viaduct, Seattle, Washington, USA	47.60146738900661	-122.33599503811082
Virgin Studios, Goldhawk Road, Shepherd's Bush, London, England, UK	51.50642000000005	-0.1272099999999341
Stroud Green, Haringey, London, England, UK	51.589264499999985	-0.10640475000000119
Gold Wing Drive, Austin Texas, USA	30.39529655157351	-97.7050528932126
Waimauku, Auckland, New Zealand	-36.775579945034366	174.55470006217897
Travel Town Museum - 5200 Zoo Drive, Griffith Park, Los Angeles, California, USA	34.15399000000008	-118.30841999999996
Lebanon, Tennessee, USA	36.20786000000004	-86.28951999999998
Zsental, Sdtirol, Italy	46.69616302400004	11.416103768000028
Experimental Techniques Centre, Brunel University, Uxbridge, Middlesex, England, UK	51.53156000000007	-0.47559999999992897
Ube City, Yamaguchi, Japan	33.95151655900003	131.24678735800012
Berck sur mer, Pas de Calais, France	50.39829000000003	1.5600800000000277
Struten fyr, Fredrikstad, Norway	59.116670000000056	10.750000000000057
2250 Montecito Drive, San Marino, California, USA	34.12907563387987	-118.10540941020837
42 Columbus Ave, San Francisco, California, USA	37.79609401999531	-122.40406714126611
11000-13000, Victory Boulevard, North Hollywood, Los Angeles, California, USA	34.18664554284749	-118.41640100389513
Caramulo, Portugal	40.57128000000006	-8.168369999999982
Golden Valley Ranch, Santa Clarita, California, USA	34.44285574295136	-118.4898425173948
