location	lat	long
W 400 N, Payson, Utah, USA	40.048640999999996	-111.75717334804602
Bar "Swim and Pool", Zaragoza, Aragn, Spain	41.64498000000003	-0.8976599999999735
Gustaf Adolfs Parken, stermalm, Stockholm, Stockholms ln, Sweden	59.32969187358208	18.069083365698823
Sea view Plaza, Duplex Rd, Pmb #612, Kololi, The Gambia, West Africa	13.448730000000069	-16.716729999999927
New Carlisle, Ohio, USA	39.93655000000007	-84.02503999999999
Zion Heights Junior High School, North York, Toronto, Ontario, Canada	43.79805995224783	-79.36992006116834
Camp Samac Oshawa, Ontario, Canada	43.946210000000065	-78.87552999999997
Apajpuszta, Hungary	48.05010000000004	19.584570000000042
Taunusstrae, Cologne, Germany	50.9323531882001	6.996630772305929
Svarfaardalur, Iceland	65.86313000000007	-18.688369999999964
8763 Wonderland Avenue, Laurel Canyon, Hollywood Hills, Los Angeles, California, USA	34.111654364706496	-118.38602586193652
Terra Vergine Restaurant, 442 King's Rd, London, England, UK	51.48284000000007	-0.17803999999995312
Grand Place, Brussels, Brussels-Capital, Belgium	50.84681000000006	4.351890000000026
Fred F. French Building, 551 5th Ave, New York City, New York, USA	40.75563287815227	-73.97927541727748
County Rd 310, Durango, Colorado, USA	37.052618688294416	-107.86125537675511
Flagstar Bank, Broad Ripple, Indiana, USA	39.86769000000004	-86.14176999999995
Turun kaupunginteatteri, Turku, Finland	60.44632992281749	22.263670062755903
Ice Palace - 401 Channelside Dr., Tampa, Florida, USA	27.943499972734053	-82.45277997547528
Cedar Avenue and Ashland Road, Cleveland, Ohio, USA	41.50054800000001	-81.6484275
Barrio Tajuksanghay, Philippines	16.641180000000077	120.8393400000001
Folgueroles, Barcelona, Catalonia, Spain	41.937760000000026	2.3145900000000665
Vistahermosa, Alicante, Comunidad Valenciana, Spain	38.362550000000056	-0.46457999999995536
Piazza San Marco, Venice, Veneto, Italy	45.433730000000025	12.338330000000042
Bodmin, Cornwall, England, UK	50.471250000000055	-4.717399999999941
Orangevale, California, USA	38.67855000000003	-121.22976999999997
Climax, North Carolina, USA	35.91295000000008	-79.71493999999996
Tularosa, New Mexico, USA	33.07286000000005	-106.01783999999998
Paris, New York, USA	43.00012000000004	-75.31190999999995
Music Concourse, California Academy of Sciences, Concourse Drive, Golden Gate Park, San Francisco, California, USA	37.770170000000064	-122.46683999999999
Buwama, Uganda	-0.029049999999926968	32.083030000000065
Guild Inn, Toronto, Ontario, Canada	43.648690000000045	-79.38543999999996
Mandal, Norway	58.03010000000006	7.455540000000042
Orient-Express Cocktail Bar, New York City, New York, USA	40.735640062178994	-74.00744005107043
Kitchener, Ontario, Canada	43.45124000000004	-80.49303999999995
Silchester, Hampshire, England, UK	51.216964525753454	-1.4980550795864256
Grisons, Switzerland	46.65591031000008	9.628887675000044
Bremer Strae, Dsseldorf, Germany	51.21808660785256	6.754395784054906
Pcking, Bavaria, Germany	48.6361293606773	12.933964901528839
Le Square d'Aramis, Lille, France	50.63865005107049	3.060020025535264
Spinney Street, Raunds, Northamptonshire, England, UK	52.343730641403155	-0.5395535768102748
Hickling Broad, Norfolk, England, UK	52.74544000000003	1.5700100000000248
Southern California desert, Palm Springs, California, USA	33.823210000000074	-116.51195999999999
Ellis Theatre - 311 Byrd Avenue, Philadelphia, Mississippi, USA	32.770574383105895	-89.110879947953
North Yarmouth, Maine, USA	43.82888000000003	-70.24938999999995
Somers, Montana, USA	48.079450000000065	-114.22900999999996
Scalinata della Trinit dei Monti, Rome, Lazio, Italy	41.90595009386548	12.482623481226913
Meteti, Panama	8.498430000000042	-77.97884999999997
Ballhaus Rixdorf, Neuklln, Berlin, Germany	52.51604000000003	13.376910000000066
Pen Argyl, Pennsylvania, USA	40.868930000000034	-75.25512999999995
3500 W. Olive Ave., Burbank, California, USA	34.152488434906864	-118.33855088447159
Elouera Road, Westleigh, New South Wales, Australia	-33.71733869124019	151.06612733362246
Szenenwerk Luenen, Zum Pier 72, 44536 Lnen, Germany	51.604268071873804	7.461538516388624
Cabo Formentor, Mallorca, Balearic Islands, Spain	39.613620000000026	3.0200400000000514
Vika, Oslo, Norway	59.91667000000007	10.733330000000024
Wasungen, Thuringia, Germany	50.66370000000006	10.368670000000066
Smithsonian Tropical Research Institute, Barro Colorado Island, Lake Gatun, Panama Canal, Panama	9.286200000000065	-79.91233999999997
Mincio Square, Rome, Lazio, Italy	41.91864584330416	12.502438108260387
The Film Factory, New Orleans, Louisiana, USA	29.953700000000026	-90.07774999999998
Tallahassee Regional Airport, Tallahassee, Florida, USA	30.39653000000004	-84.35032999999999
Face au 91 Boulevard Haussmann, Paris 8, Paris, France	48.87483951788917	2.318976021091832
Marche Jean-Talon, 7070 Ave Henri Julien, Montral, Qubec, Canada	45.536549918922304	-73.614199994951
Veterans Stadium - 3501 S. Broad Street, Philadelphia, Pennsylvania, USA	39.90712026223851	-75.17341687105645
Raczki, Podlaskie, Poland	53.989040000000045	22.782210000000077
San Nicolas de los Arroyos, Argentina	-33.32726999999994	-60.21661999999998
3900 Marysville Boulevard, Sacramento, California, USA	38.638339506736386	-121.42929404187699
378 E 1st St, Los Angeles, California, USA	34.04923253479682	-118.23936503496188
Los Angeles High School, 4600 West Olympic Blvd, Los Angeles, California, USA	34.05638994214986	-118.33281998889147
Magnolia Mound - 2161 Nicholson Drive, Baton Rouge, Louisiana, USA	30.4258200510705	-91.18791999495097
Dubai World Trade Centre - Sheikh Zayed Road, Trade Centre, Dubai, United Arab Emirates	25.225500000000068	55.28428000000008
Immanuel Presbyterian Church, Los Angeles, California, USA	34.06140000000005	-118.29479999999995
Eivissa, Balearic Islands, Spain	38.90625000000006	1.4195300000000657
Pritchard, British Columbia, Canada	50.68613000000005	-119.81938999999994
The Hudson - 1114 North Crescent Heights Blvd., West Hollywood, California, USA	34.09150000000005	-118.36591999999996
Letna Garden, Prague, Czech Republic	50.03296002943043	14.506820040538926
Belmore Ring, Ratlinghope, Shropshire, England, UK	52.55755000000005	-2.871629999999925
Centro Histrico District, Mexico City, Distrito Federal, Mexico	19.431760000000054	-99.13915999999995
Royal Military Academy Sandhurst, Camberley, Surrey, England, UK	51.338252676727535	-0.7984308112317975
Dartmoor National Park, Dartmoor, England, UK	50.45451000000003	-4.105979999999931
McNichols Sports Arena - 1635 Bryant Street, Denver, Colorado, USA	39.686933055320125	-105.01864988160423
Universidad de Alicante, Alicante, Comunitat Valenciana, Spain	38.38399000000004	-0.5283299999999258
South El Monte, California, USA	34.046440000000075	-118.04325999999998
2215 Arkansas Ave., Conway, Arkansas, USA	35.10025652842076	-92.4572912216227
Weddington Golf & Tennis - 4141 Whitsett Ave, Studio City, Los Angeles, California, USA	34.14573000000007	-118.40544999999997
Snowdoun, Alabama, USA	32.28293000000008	-86.30708999999996
Bayside, Melbourne, Victoria, Australia	-38.14123904629055	145.12428541266817
Peaflor, Sevilla, Andaluca, Spain	37.71013000000005	-5.347049999999967
Edison Studios, 2826 Decatur Street, Bronx, New York City, New York, USA	40.8670517109343	-73.88563917702555
Motril, Granada, Andaluca, Spain	36.74556000000007	-3.5152799999999615
Burnham Park, Baguio City, Benguet, Philippines	16.413020000000074	120.59076000000005
Ballerup rideskole, Ballerup, Denmark	55.73013000000003	12.361000000000047
Litpovsk Mikuls, Slovakia	48.063450000000046	18.66366000000005
Montagnareale, Messina, Sicily, Italy	38.13046000000003	14.944470000000024
Het Compagnietheater, Amsterdam, Noord-Holland, Netherlands	52.36407000000003	4.910870000000045
Khirbet Qeiyafa, Jerusalem, Israel	31.78001000000006	35.21882000000005
Manvel, Texas, USA	29.484230000000025	-95.35075999999998
Dinghy Dock Pub, Protection Island, British Columbia, Canada	50.13295000000005	-124.91957999999994
Thazwash Glacier, Kashmir, India	24.869050000000072	86.18022000000008
Thorpe Camp, Lancaster Farm, Tumby WoodsideThorpe Camp Visitor Centre, Boston, Lincolnshire, England, UK	52.97478000000007	-0.02937999999994645
Frankfurt, Michigan, USA	42.619999500000006	-83.0247255
Wien Westbahnhof, Europaplatz, Rudolfsheim-Fnfhaus, Vienna, Austria	48.19676001832192	16.33811999884619
Pyry, Ursynw, Warsaw, Mazowieckie, Poland	52.12880000000007	21.018750000000068
Bully, Brittany, France	48.147870018321946	-1.7727699816781048
Dallas, Georgia, USA	33.92527000000007	-84.84156999999999
Daigo-Ji, Fushimi District, Kyoto, Japan	35.44113726200004	137.09018248300004
Gut Barbarastein, Rommerskirchen, Rhein-Kreis Neuss, North Rhine-Westphalia, Germany	51.03573000000006	6.696040000000039
Union Square, San Francisco, California, USA	37.78782000000007	-122.40747999999996
Fox Theater, Bakersfield, California, USA	35.377440000000036	-119.02121006996917
Christopher, Illinois, USA	37.97252000000003	-89.05351999999993
Jardins, Fondation Ephrussie de Rothschild, Villa Ile-de-Frances, Cap Ferrat, Alpes-Maritimes, France	43.69607000000008	7.329070000000058
24318 Walnut Street, Santa Clarita, California, USA	34.378611442697135	-118.52910042073995
Harrisville, Queensland, Australia	-27.811429999999973	152.66804000000002
Derby, Derbyshire, England, UK	52.92343000000005	-1.4844499999999243
Birreria, Madison Square Park, New York City, New York, USA	40.74150000000003	-73.98757999999998
Willunga, South Australia, Australia	-35.271559999999965	138.55424000000005
Palac Prymasowski, Senatorska, Srdmiescie, Warsaw, Mazowieckie, Poland	52.24576674109539	21.012393907470155
Oponice, Slovakia	48.467760000000055	18.143910000000062
Medaway, Kent, UK	51.40084625147208	0.5256471635786837
Nrrebro Park Skolen, Copenhagen, Denmark	55.64192974896407	12.507662643299323
Ludwigsburg, Baden-Wrttemberg, Germany	48.89417000000003	9.191860000000077
Venosc, Isre, France	44.98959000000008	6.116390000000024
The Gate Studios, Borehamwood, Hertfordshire, England, UK	51.66458999999999	-0.2631015000000045
74 Aveling Park Road, Walthamstow, London, England, UK	51.595874683026004	-0.01769470879658871
Taksim Square, Taksim, Istanbul, Turkey	41.03667000000007	28.985330000000033
Plady Beach, Looe, Cornwall, England, UK	50.35827359155794	-4.442622566170373
Chteldon, Puy-de-Dme, France	45.97771000000006	3.5190000000000623
Sonny Bono Salton Sea National Wildlife Refuge, Imperial County, California, USA	33.17659000000003	-115.61539999999997
Requisite Krummgasse 1a, 1030 Vienna, Austria	48.200210999999996	16.386759000000012
Nu Hotel - 85 Smith Street, Brooklyn, New York City, New York, USA	40.68883995614296	-73.98897991949914
Chteau de Vigny, 1 rue Beaudoin, Vigny, Val-d'Oise, France	49.0786056566738	1.921451448237066
Htel Matignon, Paris 8, Paris, France	48.86965000389521	2.311309926712605
Jelling Kommune, Denmark	55.959300779000046	10.053934054000024
Kalaloch Beach, Washington, USA	47.13507976912443	-123.32935037181261
Dalmine, Bergamo, Lombardia, Italy	45.64793000000003	9.601530000000025
National Museum of History of Great Patriotic War - 44 Sichnevogo Povstannya, Kiev, Ukraine	50.45056000000005	30.524280000000033
Tallaght, South Dublin, County Dublin, Ireland	53.28974000000005	-6.372489999999971
Nuremberg, Bavaria, Germany	49.45434000000006	11.07349000000005
Oughterard, County Galway, Ireland	53.42853000000008	-9.318899999999928
Tjusterbyjrven j, Siuntio, Finland	60.138870000000054	24.226950000000045
Abades, Tenerife	28.143796500000004	-16.442972999999988
Karaagali, Manisa, Turkey	38.680660000000046	27.516860000000065
1302 Abbot Kinney Blvd, Venice, Los Angeles, California, USA	33.991105202868155	-118.46793893825374
Kees & Dirk's Dagwinkel, Zevenhoven, Netherlands	52.18286000000006	4.7801699489296015
Montral, Vieux-Montral, rue Saint-Paul, Qubec, Canada	45.50895000000003	-73.55184999999994
Amparo, So Paulo, Brazil	-22.704856801700018	-46.75191413494737
2100 Chartres St, New Orleans, Louisiana, USA	29.963490517889174	-90.05757213044608
Bramfeld, Hamburg, Germany	53.613050000000044	10.079160000000059
Munden House, Watford, England, UK	51.67228500000002	-0.38883149999998246
Notre-Dame-de-Grce, Montral, Qubec, Canada	45.50448000000006	-73.55586999999997
Streetsville Secondary School, Mississauga, Ontario, Canada	43.57945996999276	-79.71845007775948
Queensbury Methodist Church, Edgware, Middlesex, UK	51.594700000000046	-0.28109999999992397
Freshford, Somerset, England, UK	51.14695380000006	-2.886801441999978
Intimes Theater, Frankfurt am Main, Germany	50.10806326112233	8.672402357208682
Blue Hole, Belize	17.150000000000034	-88.68332999999996
Forest Park, Illinois, USA	41.87757000000005	-87.81434999999999
Big Basin Redwoods State Park - 21600 Big Basin Way, Boulder Creek, California, USA	37.172007659099265	-122.22210038794448
Appartement rue Beaubourg, Paris, France	48.857210000000066	2.341440000000034
Bridewell Museum, Norwich, England, UK	52.640648362607436	1.5491275113182588
Haywood Park Hotel, Asheville North Carolina, USA	35.57907995614296	-82.59553006939227
3071 Earlmar Drive, Cheviot Hills, Los Angeles, California, USA	34.03650013211952	-118.40481277465504
Kawauchi, Futaba, Fukushima, Japan	37.33750966700006	140.80955476300005
Palm Door - 401 Sabine St., Austin, Texas, USA	30.264701679150605	-97.73663145516196
Avenue de l'Opra, Paris 2, Paris, France	48.86570295720219	2.334410251062285
Colli Albani, Roma, Lazio, Italy	41.869530000000054	12.529760000000067
Deakin Street, Forestville New South Wales, Australia	-33.75528404197574	151.21809328504523
Bertrichamps, Vosges, France	48.42921000000007	6.793420000000026
St. Francois Xavier, Manitoba, Canada	50.04079000000007	-97.73396999999994
Bakehouse Studios, Melbourne, Australia	-37.80053058793605	144.97197540697687
Fortnum & Mason's, Piccadilly, London, England, UK	51.50836000000004	-0.13899999999995316
Fiumicino International Airport, Rome, Lazio, Italy	41.79595000000006	12.258680000000027
Granada Hills, CA	34.26394000000005	-118.49793999999997
800 Bush St, San Francisco, California, USA	37.78995335832985	-122.41068334554791
Elios Film Studios	41.36805004501098	2.085299944457542
Meares Island, British Columbia, Canada	49.18291000000005	-125.83618999999999
Hemel Hempstead Football Club - Vauxhall Rd., Hemel Hempstead, Hertfordshire, England, UK	51.75327000000004	-0.442929999999933
Gwinnett County Jail, 2900 University Parkway, Lawrenceville, Georgia, USA	33.98166000000003	-83.97665999999998
Blue Lagoon, Grindavk, Reykjanes, Iceland	63.88132000000007	-22.45285999999993
Vicarage Road, Watford, Hertfordshire, England, UK	51.65089997547536	-0.40178998831454626
Burlington Road, Dublin, County Dublin, Ireland	53.331182248638704	-6.247226621596778
Carrefour Vavin, Paris 6, Paris, France	48.84404399999999	2.3325907499999907
Scholl Canyon Golf & Tennis Club - 3800 E. Glenoaks Blvd. Glendale, California, USA	34.16098000000005	-118.19891999999999
Polnish, Highland, Scotland, UK	57.41262000000006	-6.193439999999953
Numbla Vale Valley, New South Wales, Australia	-36.69861174905707	148.76769204961633
Saratov, Russia	51.53161000000006	46.01081000000005
Coldstream Vineyards, Yarra Valley, Victoria, Australia	-37.75393007660562	145.34360000779037
Lund University, Lund, Sweden	55.70644000000004	13.19386000000003
Onset, Massachusetts, USA	41.74503000000004	-70.66181999999998
Leff Valley, India	17.832830000000058	73.09806000000003
Wallis, Switzerland	46.20903311500007	7.607525552000027
Lenwood, California, USA	34.879590000000064	-117.10335999999995
El meson, Quertaro, Mexico	20.706150000000036	-100.44675999999998
9537 Las Tunas Drive, Temple City, California, USA	34.106530943449215	-118.06253767562984
Mina Clavero, Cordoba, Argentina	-31.72769999999997	-65.00444999999996
Lagarde-d'Apt, Vaucluse, France	43.98374000000007	5.4728900000000635
Aboard the Magnetic Levitation Train "Magnev", Shanghai, China	31.22222000000005	121.45806000000005
Saint-Simon, Qubec, Canada	45.721490000000074	-72.85423999999995
Lavia, Finland	61.59660000000008	22.585780000000057
Creac'hmeur, Plougonvelin, Finistre, France	48.33236000000005	-4.710149999999942
Saxon, Valais, Switzerland	46.14885000000004	7.17372000000006
Vacherie, Louisiana, USA	30.00726000000003	-90.73001999999997
Collegedale, Tennessee, USA	35.058910000000026	-85.07151999999996
Flamingo Beach Hotel, Mombasa, Kenya	-3.9684199999999805	39.753100000000074
Munford, Alabama, USA	33.52666000000005	-85.95352999999994
Madridejos, Toledo, Castilla-La Mancha, Spain	39.46620000000007	-3.5291299999999524
Wakura Onsen, Nanao, Ishikawa Prefecture, Japan	37.072408661000054	136.9316994070001
Tainan Municipal An-Nan Hospital, Tainan City, Taiwan	23.064180043857153	120.2238599655207
Piliborosjeno, Hungary	47.60585000000003	18.99216000000007
Borred, Barcelona, Catalonia, Spain	42.134250000000065	1.9945200000000227
Oriole Park at Camden Yards - 333 W. Camden Street, Baltimore, Maryland, USA	39.28510000000006	-76.62056999999999
Tabernash, Colorado, USA	39.99315000000007	-105.84679999999997
107A Myddleton Road, Wood Green, London, England, UK	51.60634672522895	-0.11813548365786501
Nicorvo, Italy	45.28520000000003	8.667920000000038
Reed Ranch, Chandler, Oklahoma, USA	35.702080000000024	-96.88075999999995
Palmovka, Liben, Prague, Czech Republic	50.10255450000001	14.474583000000008
Isthmus of Corinth, Corinthia, Greece	37.91667000000007	23.000000000000057
Green Bank Hotel, Falmouth, Cornwall, England, UK	50.11567338829482	-5.171337545354248
Montevecchio, Cagliari, Sardinia, Italy	39.23791121620436	9.111911128968073
Frederiksoord, Drenthe, Netherlands	52.84289000000007	6.184000000000026
Saint-Pierre, Runion	-21.342949999999973	55.468300000000056
MediaPark, Hilversum, Noord-Holland, Netherlands	52.24326000000008	5.167930000000069
Santa Ana Star Center, Rio Rancho, New Mexico, USA	35.30842000000007	-106.68459999999999
Dame Lane, Dublin, County Dublin, Ireland	53.34385797135907	-6.264183504864476
Sils-Maria, Kanton Graubnden, Switzerland	46.431700000000035	9.765720000000044
North Ormesby, Redcar and Cleveland, England, UK	54.57005000000004	-1.212289999999939
Gloucester Road Opticians - 44 Gloucester Road, Kensington, London, England, UK	51.49461000000008	-0.18262999999996055
Thyrow, Trebbin, Brandenburg, Germany	52.25412000000006	13.237940000000037
Glimmingehus, Glimminge, Skne ln, Sweden	55.50043000000005	14.23028000000005
Goffs, California, USA	34.919880000000035	-115.06375999999995
Baathusberget, Hedmark fylke, Norway	60.795300000000054	11.082700000000045
Morphett Vale, South Australia, Australia	-35.12096999999994	138.52798000000007
Rose Bay, Sydney, New South Wales, Australia	-33.870229999999935	151.26888000000008
Old Castle Stairs, Mal Strana, Prague, Czech Republic	50.07913000000008	14.433020000000056
Taplow Goods Shed, Taplow, Berkshire, England, UK	51.532170000000065	-0.6871399999999426
Ruddington army base, Ruddington, Nottinghamshire, England, UK	52.89228000000003	-1.149409999999932
Hope Cove, Devon, England, UK	50.242200000000025	-3.8591999999999302
indoor market, Market Place, Richmond, North Yorkshire, England, UK	54.40343579523416	-1.7380332166804102
Wheaton, Illinois, USA	41.86605000000003	-88.11063999999999
Canadian Pacific Railway, Alberta, Canada	48.40474000000006	-89.24159999999995
Moia, Catalonia, Spain	41.809090000000026	2.0975500000000693
Matautu, Samoa	-14.04693999999995	-171.44046999999998
Bowmanville, Clarington, Durham, Ontario, Canada	43.913770000000056	-78.68854999999996
Habarana, Sri lanka	8.04242000000005	80.75716000000006
Tele-Sagrado, San Juan, Puerto Rico	18.466330000000028	-66.10473999999994
Primo Caffee - 8590 Sunset Blvd., Los Angeles, California, USA	34.09256000000005	-118.37913999999995
Fort Vredeburg, Yogyakarta, Yogyakarta, Indonesia	-7.8001599999999485	110.36492000000004
Bergen aan Zee, Bergen, Noord-Holland, Netherlands	52.660360000000026	4.631090000000029
Margate, New Jersey, USA	39.782334605699205	-74.22636152849599
Lessines, Belgium	50.71171000000004	3.8327800000000707
Devil's Highway Roman Road, Stratfield Saye, Hampshire, England, UK	51.33823847025432	-1.0478338537600074
Spring Studios, Houston, Texas, USA	30.018620000000055	-95.43232999999998
Auditorio Pilar Bardem, Rivas-VaciaMadrid, Spain	40.35833437399414	-3.5151781753221116
Cook Bank Building, Rhyolite, Nevada, USA	36.90327000000008	-116.77201999999994
Hyatt Regency Hotel - 300 Reunion Boulevard, Dallas, Texas, USA	32.77624000000003	-96.80925999999994
Tilleda, Saxony-Anhalt, Germany	51.91667000000007	11.500000000000057
Nieul-sur-Mer, Charente-Maritime, France	46.209880000000055	-1.158429999999953
Rawtenstall, Lancashire, England, UK	53.70037000000008	-2.2794999999999277
Cerevic, Serbia	45.219340000000045	19.662900000000036
Blue Note Tokyo - 6-3-16, Minami Aoyama, Minato, Tokyo, Japan	35.661159	139.71621600000003
Christchurch Road, Streatham Hill, Streatham, London, England, UK	51.43805999999999	-0.1268932499999893
The Richmond-San Rafael Bridge, Richmond, California, USA	37.93356299087976	-122.4216855971584
Etchingham Station, Etchingham, East Sussex, England, UK	51.01039000000003	0.44237000000003945
Zzyzx, California, USA	35.19423000000006	-116.14078999999998
Fairy Bower Falls, Bundanoon, New South Wales, Australia	-34.677746393683094	150.30309968368132
A'Zambezi River Lodge, Victoria Falls, Matabeleland North, Zimbabwe	-17.914788139949263	25.843924707008306
Bottom Line, New York, USA	41.01561000000004	-73.87441999999999
Kansallisteatteri, Helsinki, Finland	60.172450069392355	24.94383999610491
Kamouraska, Qubec, Canada	47.41771783400003	-69.69201566599997
Greystones, County Wicklow, Ireland	53.14474000000007	-6.062919999999963
8 place Saint-Laurent, Nevers, Nivre, France	46.98782748542905	3.1545196763806307
Cabin Cafe, 20852 Chatsworth St., Chatsworth, California, USA	34.26442482328697	-118.58777000876695
Funpark Meppen, Meppen, Lower Saxony, Germany	52.68993000000006	7.291150000000073
1355 N. Laurel Ave., West Hollywood, CA 90046, USA	34.09591508381904	-118.36449670791713
Valsan, Segovia, Castilla y Len, Spain	40.878720000000044	-4.026789999999949
Felpham, West Sussex, England, UK	50.79338000000007	-0.6432099999999537
Roma Termini Railway Station, Rome, Lazio, Italy	41.90119993392595	12.500870056696368
Vila-Sacra, Girona, Catalonia, Spain	42.26547000000005	3.01914000000005
Basilica Cistern, Fatih, Istanbul, Turkey	41.00839000000008	28.978059959461163
Desert Road, Waiouru, Tongariro National Park, Central Plateau, New Zealand	-39.007259999999974	175.74272000000008
Margery Reed Hall, University of Denver, Denver, Colorado, USA	39.67849000000007	-104.96698999999995
Royal Oak, Paddington, London, England, UK	51.518770000000075	-0.19767999999993435
Solebury, Pennsylvania, USA	40.380660000000034	-75.00821999999994
Uluwatu, Indonesia	-8.831429999999955	115.08702000000005
Lanzhot, Czech Republic	48.72425000000004	16.96661000000006
Provincial Plaza, Poblacion, Bontoc, Mountain Province, Philippines	17.089680000000044	120.97703000000001
Queen Street West, Toronto, Ontario, Canada	43.64469992410521	-79.41633972590202
Guadalupe, Zacatecas, Mexico	22.74714000000006	-102.51870999999994
Guayana, Brazil	-4.366669999999942	-56.433329999999955
City Bank Plaza - 505 S Flower St, Los Angeles, California, USA	34.174686762681176	-118.30788509077259
La Seyne sur Mer, France	43.10157000000004	5.881730000000061
Amazon Rainforest, Bolivia	-2.499999999999943	-59.99999999999994
Carlsbad, New Mexico, USA	32.41896000000003	-104.22900999999996
230 W Huron Rd, Cleveland, Ohio, USA	41.49680241661365	-81.69409007937563
Netherby, South Australia, Australia	-34.96950999999996	138.62686000000008
Maritime Museum of San Diego, San Diego, California, USA	32.72083004154574	-117.17343001021509
Artscape Wychwood Barns, Toronto, Ontario, Canada	43.67973000057697	-79.42486994330359
Pocono Lake, Pennsylvania, USA	41.11510000000004	-75.51309999999995
Merano, Bolzano, Trentino-Alto Adige, Italy	46.66283000000004	11.159640000000024
Pop- en Cultuurhuis Pius X, Volendam, Noord-Holland, Netherlands	52.49631000000005	5.071820000000059
Manuela Complex Crossing, Epifanio delos Santos Avenue, Mandaluyong City, Metro Manila, Philippines	14.578861786282962	121.05461044522208
South Pier, Blackpool, Lancashire, England, UK	53.79550000000006	-3.0562499999999773
Marlborough Correctional Facility, Keene, New Hampshire, USA	42.933200000000056	-72.28149999999994
Pyalong, Victoria, Australia	-37.133329999999944	144.7666700000001
Hantan River, South Korea	38.00000000000006	127.00000000000011
Xinglong County, China	42.26167000000004	127.38611000000003
American Writers Museum - 180 N. Michigan, Downtown, Chicago, Illinois, USA	41.884250000000065	-87.63244999999995
Paris 19, Paris, France	48.88170000000008	2.3822000000000685
Ifni, Morocco	29.33173000000005	-8.744359999999972
Riverwood Studios - 600 Chestlehurst Rd, Senoia, Georgia, USA	33.28993107288436	-84.5249051971868
Maincy, Seine-et-Marne, France	48.54849000000007	2.7000300000000266
Pigalle Club - 215 Piccadilly, London, England, UK	51.50949000000003	-0.13540999999997894
1313 Cota Drive, Torrance, California, USA	33.835007420480146	-118.32259362020295
Mnkeboe, Sdbrookmerland, Lower Saxony, Germany	53.51437000000004	7.37513000000007
Devil's Hole State Park, Niagara Falls, New York, USA	43.13244000000003	-79.04659999999996
Obergnigl, Salzburg, Austria	47.800650000000076	13.043370000000039
Cabrini College, 610 King of Prussia Road, Radnor, Pennsylvania, USA	40.055230047752296	-75.36698006621363
Yokohama Bay, O'ahu, Hawaii, USA	21.55063000000007	-158.24333999999996
Lyons-la-Fort, Eure, France	49.311000000000035	1.1579000000000406
Lone Pine Station, Lone Pine, California, USA	36.607216648904334	-118.0613334795459
Day Spa and Nail, 160 Juan Tabo Blvd NE, Albuquerque, New Mexico, USA	35.07197438773156	-106.51505643733104
Sutton Square, Heston, Hounslow, Middlesex, England, UK	51.48511000000008	-0.37315999999992755
Escola Massana, Barcelona, Catalonia, Spain	41.38045997446483	2.1704399705696718
